{
  "schemaVersion": 1,
  "format": "apk",
  "platform": "android",
  "bundleId": "com.acme.adaptive",
  "name": "Adaptive",
  "version": "4.2.0",
  "buildNumber": "4201",
  "minOsVersion": "8.0",
  "targetOsVersion": "15",
  "isSimulator": false,
  "isDebuggable": false,
  "deviceFamilies": [
    "phone",
    "tablet"
  ],
  "architectures": [],
  "permissions": [],
  "signing": null,
  "icon": {
    "contentType": "image/png",
    "width": 108,
    "height": 108,
    "sha256": ""
  },
  "warnings": [
    "adaptive icon rendered from foreground layer only"
  ]
}
